{"profileId":"thymeleaf-1","version":"1.0","contentHash":"aaaaaaaaaaaaaaaaaaaaaaaaaaaaaaaaaaaaaaaaaaaaaaaaaaaaaaaaaaaaaaaa","status":"APPROVED","rendererType":"THYMELEAF","templateEngine":"FREEMARKER","templateSetVersion":"1.0","templateSetHash":"bbbbbbbbbbbbbbbbbbbbbbbbbbbbbbbbbbbbbbbbbbbbbbbbbbbbbbbbbbbbbbbb","componentMappingVersion":"1.0","supportedFeatures":["CRUD"],"forbiddenFallbacks":["RASTERIZED_FORM"],"outputConventionVersion":"1.0","validatorProfile":"default@1.0#cccccccccccccccccccccccccccccccccccccccccccccccccccccccccccccccc","supportedViewTypes":["THYMELEAF"]}
